<?xml version="1.0" encoding="UTF-8"?>

<!--
VNUML Root Scenario (1)
See the tutorial/index.html document for details
-->

<vnx xmlns:xsi="http://www.w3.org/2001/XMLSchema-instance"
  xsi:noNamespaceSchemaLocation="/usr/share/xml/vnx/vnx-2.00.xsd">
  <global>
    <version>2.0</version>
    <scenario_name>tutorial_ubuntu-dynamips</scenario_name>
    <automac/>
    <vm_mgmt type="none"/>
    <!--vm_mgmt type="private" network="10.250.0.0" mask="24">
       <host_mapping />
    </vm_mgmt--> 
    <vm_defaults>
    	<console id="0" display="no"/>
	    <console id="1" display="yes"/>
    </vm_defaults>
    <dynamips_ext>tutorial_ubuntu-dynamips-dn.xml</dynamips_ext>
  </global>

  <net name="Net0" mode="virtual_bridge" />
  <net name="Net1" mode="virtual_bridge" />
  <!--net name="Net1" type='ppp' mode="virtual_bridge" /-->
  <net name="Net2" mode="virtual_bridge" />
  <net name="Net3" mode="virtual_bridge" />

  <vm name="h1" type="libvirt" subtype="kvm" os="linux">
    <filesystem type="cow">/usr/share/vnx/filesystems/rootfs_ubuntu-gui</filesystem>
    <mem>384M</mem>
    <console id="0" display="yes"/>
    <console id="1" display="no"/>
    <if id="1" net="Net0">
      <ipv4>10.0.0.2/24</ipv4>
    </if>
    <route type="ipv4" gw="10.0.0.1">default</route>
    
    <filetree seq="vnxtxt" root="/tmp/" perms="644">conf/txtfile</filetree>

    <!-- Start xeyes application -->
    <exec seq="xeyes"     type="verbatim" ostype="xexec">xeyes</exec>

    <!-- Start xeyes application and wait until it is closed -->
    <exec seq="xeyes2"    type="verbatim" ostype="xsystem">xeyes</exec>

    <!-- Start gedit, maximize the window and show a text file -->
    <exec seq="vnxtxt"    type="verbatim" ostype="xexec">gedit /tmp/vnx.txt</exec>
    <exec seq="vnxtxt"    type="verbatim" ostype="xexec">sleep 3; wmctrl -r vnx.txt -b add,maximized_vert,maximized_horz</exec>
    <exec seq="vnxtxtoff" type="verbatim" ostype="system">pkill gedit; rm /tmp/vnx.*</exec>

    <!-- Start firefox and connect to h3 web server -->
    <exec seq="www-h3"    type="verbatim" ostype="xexec">firefox http://10.0.2.2</exec>
    <exec seq="www-h3-off" type="verbatim" ostype="system">pkill firefox</exec>

    <!-- Start calculator  -->
    <exec seq="calc"      type="verbatim" ostype="xexec">gcalctool</exec>
    <exec seq="calcoff"   type="verbatim" ostype="system">pkill gcalctool</exec>
   
  </vm>
  
  <vm name="h2" type="libvirt" subtype="kvm" os="linux">
    <filesystem type="cow">/usr/share/vnx/filesystems/rootfs_ubuntu</filesystem>
    <mem>128M</mem>
    <if id="1" net="Net0">
      <ipv4>10.0.0.3/24</ipv4>
    </if>
    <route type="ipv4" gw="10.0.0.3">default</route>
  </vm>

  <vm name="r1" type="dynamips" subtype="3600" os="">
    <filesystem type="cow">/usr/share/vnx/filesystems/c3640</filesystem>
    <mem>96M</mem>
    <if id="1" net="Net0" name="e0/0">
      <ipv4>10.0.0.1/24</ipv4>
    </if>
    <!--if id="2" net="Net1" name="s1/0"-->
    <if id="2" net="Net1" name="e0/2">
      <ipv4>10.0.1.1/24</ipv4>
    </if>
    <if id="3" net="Net3" name="e0/1">
      <ipv4>10.0.3.1/24</ipv4>
    </if>
    <route type="ipv4" gw="10.0.1.2">10.0.2.0/24</route>
    <exec seq="brief" type="verbatim"    ostype="show">show ip interface brief</exec>
    <exec seq="iproutes" type="verbatim" ostype="show">show ip route</exec>
    <exec seq="showcfg"  type="verbatim" ostype="show">show running-config</exec>    
  </vm>

  <vm name="r2" type="dynamips" subtype="3600" os="">
    <filesystem type="cow">/usr/share/vnx/filesystems/c3640</filesystem>
    <mem>96M</mem>
    <!--if id="1" net="Net1" name="s1/0"-->
    <if id="1" net="Net1" name="e0/1">
      <ipv4>10.0.1.2/24</ipv4>
    </if>
    <if id="2" net="Net2" name="e0/0">
      <ipv4>10.0.2.1/24</ipv4>
    </if>
    <route type="ipv4" gw="10.0.1.1">default</route>
    <exec seq="brief" type="verbatim"    ostype="show">show ip interface brief</exec>
    <exec seq="iproutes" type="verbatim" ostype="show">show ip route</exec>
    <exec seq="showcfg"  type="verbatim" ostype="show">show running-config</exec>    
  </vm>

  <vm name="h3" type="libvirt" subtype="kvm" os="linux">
    <filesystem type="cow">/usr/share/vnx/filesystems/rootfs_ubuntu</filesystem>
   <mem>128M</mem>
   <if id="1" net="Net2">
      <ipv4>10.0.2.2/24</ipv4>
    </if>
    <route type="ipv4" gw="10.0.2.1">default</route>
    <!-- Copy the files under conf/tutorial_ubuntu/h3 to vm /var/www directory -->
    <filetree seq="start-www" root="/var/www/">conf/tutorial_ubuntu/h3</filetree>
    <!-- Start/stop apache www server -->
    <exec seq="start-www" type="verbatim" ostype="system">chmod 644 /var/www/*</exec>
    <exec seq="start-www" type="verbatim" ostype="system">service apache2 start</exec>
    <exec seq="stop-www" type="verbatim"  ostype="system">service apache2 stop</exec>    
  </vm>
  
  <vm name="h4" type="libvirt" subtype="kvm" os="linux">
    <filesystem type="cow">/usr/share/vnx/filesystems/rootfs_ubuntu</filesystem>
    <mem>128M</mem>
    <if id="1" net="Net2">
      <ipv4>10.0.2.3/24</ipv4>
    </if>
    <route type="ipv4" gw="10.0.2.1">default</route> 
    <!-- Copy the files under conf/tutorial_ubuntu/h4 to vm /var/www directory -->
    <filetree seq="start-www" root="/var/www/">conf/tutorial_ubuntu/h4</filetree>
    <!-- Start/stop apache www server -->
    <exec seq="start-www" type="verbatim" ostype="system">chmod 644 /var/www/*</exec>
    <exec seq="start-www" type="verbatim" ostype="system">service apache2 start</exec>
    <exec seq="stop-www" type="verbatim"  ostype="system">service apache2 stop</exec>           
  </vm>
  
  <host>
    <hostif net="Net3">
       <ipv4>10.0.3.2/24</ipv4>
    </hostif>
    <route type="ipv4" gw="10.0.3.1">10.0.0.0/16</route>
  </host>

</vnx>