<?xml version="1.0" encoding="UTF-8"?>

<!--

~~~~~~~~~~~~~~~~~~~~
VNX Sample scenarios
~~~~~~~~~~~~~~~~~~~~

Name:        simple_ubuntu
Description: Just one Ubuntu virtual machine connected to a Network named Net0 with address 10.0.0.4. 
             The host has an interface in Net0 with address 10.0.0.1  
             This simple scenario is supposed to be used for testing the different 
             types of virtual machines supported by VNX. You can start several simple_*.xml
             scenarios and test the connectivity among virtual machines and the host, as all
             scenarios share the same "Net0" network.  

This file is part of the Virtual Networks over LinuX (VNX) Project distribution. 
(www: http://www.dit.upm.es/vnx - e-mail: vnx@dit.upm.es) 

Departamento de Ingenieria de Sistemas Telematicos (DIT)
Universidad Politecnica de Madrid
SPAIN

-->


<vnx xmlns:xsi="http://www.w3.org/2001/XMLSchema-instance"
  xsi:noNamespaceSchemaLocation="/usr/share/xml/vnx/vnx-2.00.xsd">
  <global>
    <version>2.0</version>
    <scenario_name>simple_ubuntu</scenario_name>
    <ssh_key>~/.ssh/id_dsa.pub</ssh_key>
    <automac offset="4"/>
    <!--vm_mgmt type="none" /-->
    <vm_mgmt type="private" network="10.250.0.0" mask="24" offset="16">
       <host_mapping />
    </vm_mgmt> 
    <vm_defaults>
	    <console id="0" display="no"/>
	    <console id="1" display="yes"/>
        <exec_mode type="uml">mconsole</exec_mode>
        <exec_mode type="libvirt" subtype="kvm">cdrom</exec_mode>
        <exec_mode type="libvirt" subtype="kvm" os="windows">cdrom</exec_mode>
        <exec_mode type="libvirt" subtype="kvm" os="olive">sdisk</exec_mode>
    </vm_defaults>
    <extension plugin="ospf" conf="simple_ubuntu-ospf_conf.xml" />
  </global>
    
  <net name="Lan1" mode="virtual_bridge" />
  <net name="Lan2" mode="virtual_bridge" />
  <net name="Ptp12" mode="virtual_bridge" />
  
  <!-- NODES -->
  <vm name="r1" type="libvirt" subtype="kvm" os="linux" exec_mode="cdrom">
    <filesystem type="cow">/usr/share/vnx/filesystems/rootfs_ubuntu</filesystem>
    <mem>256M</mem>
    <if id="1" net="Lan1">
      <ipv4>10.0.1.1/24</ipv4>
      <ipv6>2001:db8:1::1/64</ipv6>
    </if>
    <if id="2" net="Ptp12">
      <ipv4>10.0.0.1/30</ipv4>
      <ipv6>2001:db8:12::1/64</ipv6>
    </if>
    <filetree seq="on_boot" root="/root/">conf/on_boot.txt</filetree>
    <filetree seq="start-www" root="/var/www/" user="www-data" group="www-data" perms="644">conf/txtfile</filetree>
    <exec seq="on_boot" type="verbatim"  ostype="system">cp /root/on_boot.txt /root/on_boot2.txt</exec>
    <exec seq="movefile" type="verbatim"  ostype="system">mv /tmp/vnx.txt /root/</exec>
    <!--exec seq="start-www" type="verbatim" ostype="system">chmod 644 /var/www/*</exec-->
    <exec seq="start-www" type="verbatim" ostype="system">service apache2 start</exec>
    <exec seq="stop-www" type="verbatim"  ostype="system">service apache2 stop</exec>
    <exec seq="file" type="file"  ostype="system">conf/cmdfile</exec>
    <exec seq="on_shutdown" type="verbatim"  ostype="system">touch /root/on_shutdown.txt</exec>
  </vm>

  <vm name="r2" type="uml" subtype="" os="" exec_mode="mconsole">
    <filesystem type="cow">/usr/share/vnx/filesystems/rootfs_uml</filesystem>
    <mem>64M</mem>
    <kernel>/usr/share/vnx/kernels/linux</kernel>
    <if id="1" net="Lan2" name="fxp0">
      <ipv4>10.0.2.1/24</ipv4>
      <ipv6>2001:db8:2::1/64</ipv6>
    </if>
    <if id="2" net="Ptp12" name="fxp1">
      <ipv4>10.0.0.2/30</ipv4>
      <ipv6>2001:db8:12::2/64</ipv6>
    </if>
    <filetree seq="on_boot" root="/root/">conf/on_boot.txt</filetree>
    <filetree seq="copyfile" root="/tmp">conf/txtfile</filetree>
    <filetree seq="start-www" root="/var/www">conf/txtfile</filetree>
    <exec seq="on_boot" type="verbatim">cp /root/on_boot.txt /root/on_boot2.txt</exec>
    <exec seq="movefile" type="verbatim">mv /tmp/vnx.txt /root/</exec>
    <!--exec seq="start-www" type="verbatim">chmod 644 /var/www/*</exec-->
    <exec seq="start-www" type="verbatim">/etc/init.d/apache2 start</exec>
    <exec seq="stop-www" type="verbatim">/etc/init.d/apache2 stop</exec>
    <exec seq="on_shutdown" type="verbatim">touch /root/on_shutdown.txt</exec>
  </vm>

  <vm name="h1" type="libvirt" subtype="kvm" os="linux" exec_mode="cdrom">
    <filesystem type="cow">/usr/share/vnx/filesystems/rootfs_ubuntu</filesystem>
    <mem>256M</mem>
    <if id="1" net="Lan1">
      <ipv4>10.0.1.2/24</ipv4>
      <ipv6>2001:db8:1::2/64</ipv6>
    </if>
    <route type="ipv4" gw="10.0.1.1">default</route>    
    <route type="ipv6" gw="2001:db8:1::1">default</route>       
  </vm>

  <vm name="h2" type="uml" exec_mode="mconsole">
    <filesystem type="cow">/usr/share/vnx/filesystems/rootfs_uml</filesystem>
    <mem>64M</mem>
    <kernel>/usr/share/vnx/kernels/linux</kernel>
    <if id="1" net="Lan2">
      <ipv4>10.0.2.2/24</ipv4>
      <ipv6>2001:db8:2::2/64</ipv6>
    </if>
    <route type="ipv4" gw="10.0.2.1">default</route>    
    <route type="ipv6" gw="2001:db8:2::1">default</route>       
  </vm>
  

  <host>
    <hostif net="Lan1">
       <ipv4>10.0.1.3/24</ipv4>
       <ipv6>2001:db8:1::3/64</ipv6>
    </hostif>
    <route type="ipv4" gw="10.0.1.1">10.0.0.0/16</route>    
    <route type="ipv6" gw="2001:db8:1::1">2001:db8::/32</route>    
  </host>
  
</vnx>
