<?xml version="1.0" encoding="UTF-8"?>

<!--

~~~~~~~~~~~~~~~~~~~~
VNX Sample scenarios
~~~~~~~~~~~~~~~~~~~~

Name:        tutorial_lxc_ubuntu-sdn
Description: As simple tutorial scenario made of 6 Ubuntu virtual machines (4 hosts: h1, h2, h3 and h4; 
             and 2 routers: r1 and r2) connected through three virtual networks based on Openvswitch. The host participates 
             in the scenario having a network interface in Net3.     
             Another VM, sdnctrl, run and SDN controller that controls the Openvswitchs of the scenario.

This file is part of the Virtual Networks over LinuX (VNX) Project distribution. 
(www: http://www.dit.upm.es/vnx - e-mail: vnx@dit.upm.es) 

Departamento de Ingenieria de Sistemas Telematicos (DIT)
Universidad Politecnica de Madrid
SPAIN

-->

<vnx xmlns:xsi="http://www.w3.org/2001/XMLSchema-instance"
  xsi:noNamespaceSchemaLocation="/usr/share/xml/vnx/vnx-2.00.xsd">
  <global>
    <version>2.0</version>
    <scenario_name>tutorial_lxc_ubuntu_sdn</scenario_name>
    <automac/>
    <vm_mgmt type="none" />
    <!--vm_mgmt type="private" network="10.250.0.0" mask="24" offset="200">
       <host_mapping />
    </vm_mgmt-->
    <vm_defaults>
        <console id="0" display="no"/>
        <console id="1" display="yes"/>
    </vm_defaults>

    <cmd-seq seq="ls12">ls1,ls2</cmd-seq>
    <cmd-seq seq="ls123">ls12,ls3</cmd-seq>
    <cmd-seq seq="ls1234">ls123,ls4</cmd-seq>

    <help>
        <seq_help seq='start-www'>Start apache2 web server</seq_help>
        <seq_help seq='stop-www'>Stop apache2 web server</seq_help>
    </help>
    
  </global>

  <net name="Net0"   mode="openvswitch" controller="tcp:10.1.4.2:6633" of_version="OpenFlow10" />
  <net name="Net1"   mode="openvswitch" controller="tcp:10.1.4.2:6633" of_version="OpenFlow10" />
  <net name="Net2"   mode="openvswitch" controller="tcp:10.1.4.2:6633" of_version="OpenFlow10" />
  <net name="Net3"   mode="openvswitch" controller="tcp:10.1.4.2:6633" of_version="OpenFlow10" />
  <net name="MgmtNet" mode="openvswitch" />

  <vm name="h1" type="lxc">
    <filesystem type="cow">/usr/share/vnx/filesystems/rootfs_lxc</filesystem>
    <if id="1" net="Net0">
      <ipv4>10.1.0.2/24</ipv4>
    </if>
    <route type="ipv4" gw="10.1.0.1">default</route>   
    <filetree seq="on_boot" root="/tmp/">conf/tutorial_lxc_ubuntu-sdn/hosts</filetree>
    <exec seq="on_boot" type="verbatim">cat /tmp/hosts >> /etc/hosts</exec>
  </vm>

  <vm name="h2" type="lxc">
    <filesystem type="cow">/usr/share/vnx/filesystems/rootfs_lxc</filesystem>
    <if id="1" net="Net0">
      <ipv4>10.1.0.3/24</ipv4>
    </if>
    <route type="ipv4" gw="10.1.0.1">default</route>
    <filetree seq="on_boot" root="/tmp/">conf/tutorial_lxc_ubuntu-sdn/hosts</filetree>
    <exec seq="on_boot" type="verbatim">cat /tmp/hosts >> /etc/hosts</exec>
  </vm>

  <vm name="r1" type="lxc">
    <filesystem type="cow">/usr/share/vnx/filesystems/rootfs_lxc</filesystem>
    <if id="1" net="Net0">
      <ipv4>10.1.0.1/24</ipv4>
    </if>
    <if id="2" net="Net1">
      <ipv4>10.1.1.1/24</ipv4>
    </if>
    <if id="3" net="Net3">
      <ipv4>10.1.3.1/24</ipv4>
    </if>
    <route type="ipv4" gw="10.1.1.2">10.1.2.0/24</route>
    <forwarding type="ip" />
    <filetree seq="on_boot" root="/tmp/">conf/tutorial_lxc_ubuntu-sdn/hosts</filetree>
    <exec seq="on_boot" type="verbatim">cat /tmp/hosts >> /etc/hosts</exec>
  </vm>

  <vm name="r2" type="lxc">
    <filesystem type="cow">/usr/share/vnx/filesystems/rootfs_lxc</filesystem>
    <if id="1" net="Net1" name="s1/0">
      <ipv4>10.1.1.2/24</ipv4>
    </if>
    <if id="2" net="Net2" name="e0/0">
      <ipv4>10.1.2.1/24</ipv4>
    </if>
    <route type="ipv4" gw="10.1.1.1">default</route>
    <forwarding type="ip" />
    <filetree seq="on_boot" root="/tmp/">conf/tutorial_lxc_ubuntu-sdn/hosts</filetree>
    <exec seq="on_boot" type="verbatim">cat /tmp/hosts >> /etc/hosts</exec>
  </vm>

  <vm name="h3" type="lxc">
   <filesystem type="cow">/usr/share/vnx/filesystems/rootfs_lxc</filesystem>
   <if id="1" net="Net2">
      <ipv4>10.1.2.2/24</ipv4>
    </if>
    <route type="ipv4" gw="10.1.2.1">default</route>
    <filetree seq="on_boot" root="/tmp/">conf/tutorial_lxc_ubuntu-sdn/hosts</filetree>
    <!-- Copy the files under conf/tutorial_ubuntu/h3 to vm /var/www directory -->
    <filetree seq="start-www" root="/var/www/">conf/tutorial_ubuntu/h3</filetree>
    <exec seq="on_boot" type="verbatim">cat /tmp/hosts >> /etc/hosts</exec>
    <!-- Start/stop apache www server -->
    <exec seq="start-www" type="verbatim" ostype="system">chmod 644 /var/www/*</exec>
    <exec seq="start-www" type="verbatim" ostype="system">service apache2 start</exec>
    <exec seq="stop-www" type="verbatim"  ostype="system">service apache2 stop</exec>    
  </vm>
  
  <vm name="h4" type="lxc">
    <filesystem type="cow">/usr/share/vnx/filesystems/rootfs_lxc</filesystem>
    <if id="1" net="Net2">
      <ipv4>10.1.2.3/24</ipv4>
    </if>
    <route type="ipv4" gw="10.1.2.1">default</route>    
    <filetree seq="on_boot" root="/tmp/">conf/tutorial_lxc_ubuntu-sdn/hosts</filetree>
    <!-- Copy the files under conf/tutorial_ubuntu/h4 to vm /var/www directory -->
    <filetree seq="start-www" root="/var/www/">conf/tutorial_ubuntu/h4</filetree>
    <exec seq="on_boot" type="verbatim">cat /tmp/hosts >> /etc/hosts</exec>
    <!-- Start/stop apache www server -->
    <exec seq="start-www" type="verbatim" ostype="system">chmod 644 /var/www/*</exec>
    <exec seq="start-www" type="verbatim" ostype="system">service apache2 start</exec>
    <exec seq="stop-www" type="verbatim"  ostype="system">service apache2 stop</exec>    
  </vm>

  <vm name="sdnctrl" type="lxc">
    <filesystem type="cow">/usr/share/vnx/filesystems/rootfs_sdn</filesystem>
    <if id="1" net="MgmtNet">
      <ipv4>10.1.4.2/24</ipv4>
    </if>
    <route type="ipv4" gw="10.1.2.1">default</route>    

    <filetree seq="on_boot" root="/tmp/">conf/tutorial_lxc_ubuntu-sdn/hosts</filetree>
    <filetree seq="on_boot" root="/root/floodlight/">conf/tutorial_lxc_ubuntu-sdn/sdnctrl/</filetree>

    <exec seq="on_boot" type="verbatim">cat /tmp/hosts >> /etc/hosts</exec>
    <exec seq="on_boot" type="verbatim">
       mkdir -p /etc/floodlight;
       ln -s /root/floodlight/floodlight.properties /etc/floodlight/;
    </exec>
    <exec seq="on_boot" type="verbatim">chmod +x /root/floodlight/start-floodlight</exec>
    <!--exec seq="on_boot,start_ctrl" type="verbatim">/root/floodlight/start-floodlight</exec-->
    <exec seq="on_boot,start_ctrl" type="verbatim">java -Dlogback.configurationFile=/root/floodlight/logback.xml -jar /root/floodlight/target/floodlight.jar -cf /etc/floodlight/floodlight.properties &amp;</exec>

    <exec seq="stop_ctrl" type="verbatim">pkill -f "java -Dlogback.configurationFile"</exec>

  </vm>
  
  <host>
    <hostif net="Net3">
       <ipv4>10.1.3.2/24</ipv4>
    </hostif>
    <hostif net="MgmtNet">
       <ipv4>10.1.4.1/24</ipv4>
    </hostif>
    <route type="ipv4" gw="10.1.3.1">10.1.0.0/16</route>
  </host>

</vnx>
